{
  "$schema": "./_schema.json",
  "title": "reset soft",
  "grid": {
    "x": 140.8,
    "y": 69.8
  },
  "nodes": [
    {
      "id": "file-txt",
      "kind": "tree",
      "label": [
        "file.txt",
        "v1"
      ],
      "col": 0,
      "row": 2,
      "dy": -18.89
    },
    {
      "id": "file-txt-2",
      "kind": "ref",
      "label": [
        "file.txt",
        "v2"
      ],
      "col": 1,
      "row": 2,
      "dx": -0.5,
      "dy": -18.89
    },
    {
      "id": "head",
      "kind": "commit",
      "label": "HEAD",
      "col": 1,
      "row": 0,
      "dx": 0.7
    },
    {
      "id": "master",
      "kind": "blob",
      "label": "master",
      "col": 1,
      "row": 1,
      "dx": 0.7,
      "dy": -25.01
    },
    {
      "id": "working",
      "kind": "ref",
      "label": [
        "Working",
        "Directory"
      ],
      "col": 2,
      "row": 3,
      "dy": 14.06
    },
    {
      "id": "node_9e5e6a4",
      "kind": "ref",
      "label": "9e5e6a4",
      "col": 0,
      "row": 4
    },
    {
      "id": "head-2",
      "kind": "commit",
      "label": "HEAD",
      "col": 0,
      "row": 3,
      "dy": 14.01
    },
    {
      "id": "index",
      "kind": "tree",
      "label": "Index",
      "col": 1,
      "row": 3,
      "dy": 14.01
    }
  ],
  "edges": []
}
