{
  "$schema": "./_schema.json",
  "title": "advance testing",
  "grid": {
    "x": 89.1,
    "y": 61.3
  },
  "nodes": [
    {
      "id": "master",
      "kind": "ref",
      "label": "master",
      "col": 3,
      "row": 0,
      "dx": 32.7
    },
    {
      "id": "f30ab",
      "kind": "commit",
      "label": "f30ab",
      "col": 3,
      "row": 1,
      "dx": 22.7
    },
    {
      "id": "node_87ab2",
      "kind": "commit",
      "label": "87ab2",
      "col": 5,
      "row": 1,
      "dx": -10.5
    },
    {
      "id": "node_34ac2",
      "kind": "commit",
      "label": "34ac2",
      "col": 2,
      "row": 1,
      "dx": -33.2
    },
    {
      "id": "node_98ca9",
      "kind": "commit",
      "label": "98ca9",
      "col": 0,
      "row": 1
    },
    {
      "id": "testing",
      "kind": "ref",
      "label": "testing",
      "col": 5,
      "row": 2,
      "dx": -0.5
    },
    {
      "id": "head",
      "kind": "goldref",
      "label": "HEAD",
      "col": 5,
      "row": 3,
      "dx": 0.5
    }
  ],
  "edges": []
}
