{
  "$schema": "./_schema.json",
  "title": "distributed",
  "grid": {
    "x": 146.4,
    "y": 71.2
  },
  "nodes": [
    {
      "id": "version-3",
      "kind": "commit",
      "label": "Version 3",
      "col": 1,
      "row": 0
    },
    {
      "id": "version-2",
      "kind": "commit",
      "label": "Version 2",
      "col": 1,
      "row": 1,
      "dy": -29.2
    },
    {
      "id": "version-1",
      "kind": "commit",
      "label": "Version 1",
      "col": 1,
      "row": 1,
      "dy": 12.8
    },
    {
      "id": "version-3-2",
      "kind": "commit",
      "label": "Version 3",
      "col": 0,
      "row": 5,
      "dy": -13.0
    },
    {
      "id": "version-2-2",
      "kind": "commit",
      "label": "Version 2",
      "col": 0,
      "row": 5,
      "dy": 29.0
    },
    {
      "id": "version-1-2",
      "kind": "commit",
      "label": "Version 1",
      "col": 0,
      "row": 6
    },
    {
      "id": "file",
      "kind": "tree",
      "label": "File",
      "col": 0,
      "row": 4,
      "dy": -29.8
    },
    {
      "id": "version-3-3",
      "kind": "commit",
      "label": "Version 3",
      "col": 2,
      "row": 5,
      "dy": -13.0
    },
    {
      "id": "version-2-3",
      "kind": "commit",
      "label": "Version 2",
      "col": 2,
      "row": 5,
      "dy": 29.0
    },
    {
      "id": "version-1-3",
      "kind": "commit",
      "label": "Version 1",
      "col": 2,
      "row": 6
    },
    {
      "id": "file-2",
      "kind": "tree",
      "label": "File",
      "col": 2,
      "row": 4,
      "dx": -0.8,
      "dy": -29.8
    }
  ],
  "edges": []
}
