{
  "$schema": "./_schema.json",
  "title": "undomerge reset",
  "grid": {
    "x": 119.0,
    "y": 53.0
  },
  "nodes": [
    {
      "id": "c1",
      "kind": "commit",
      "label": "C1",
      "col": 0,
      "row": 2
    },
    {
      "id": "c2",
      "kind": "commit",
      "label": "C2",
      "col": 1,
      "row": 2
    },
    {
      "id": "c5",
      "kind": "commit",
      "label": "C5",
      "col": 2,
      "row": 2
    },
    {
      "id": "c3",
      "kind": "commit",
      "label": "C3",
      "col": 2,
      "row": 3
    },
    {
      "id": "c4",
      "kind": "commit",
      "label": "C4",
      "col": 3,
      "row": 3
    },
    {
      "id": "c6",
      "kind": "commit",
      "label": "C6",
      "col": 3,
      "row": 2
    },
    {
      "id": "m",
      "kind": "commit",
      "label": "M",
      "col": 4,
      "row": 2
    },
    {
      "id": "master",
      "kind": "ref",
      "label": "master",
      "col": 3,
      "row": 1,
      "dx": -0.5
    },
    {
      "id": "head",
      "kind": "symref",
      "label": "HEAD",
      "col": 3,
      "row": 0,
      "dx": -0.5
    },
    {
      "id": "topic",
      "kind": "ref",
      "label": "topic",
      "col": 3,
      "row": 4,
      "dx": -0.5
    }
  ],
  "edges": []
}
