{
  "$schema": "./_schema.json",
  "title": "undomerge start",
  "grid": {
    "x": 119.0,
    "y": 53.0
  },
  "nodes": [
    {
      "id": "c1",
      "kind": "commit",
      "label": "C1",
      "col": 0,
      "row": 2
    },
    {
      "id": "c2",
      "kind": "commit",
      "label": "C2",
      "col": 1,
      "row": 2
    },
    {
      "id": "c5",
      "kind": "commit",
      "label": "C5",
      "col": 2,
      "row": 2
    },
    {
      "id": "c3",
      "kind": "commit",
      "label": "C3",
      "col": 2,
      "row": 3
    },
    {
      "id": "c4",
      "kind": "commit",
      "label": "C4",
      "col": 3,
      "row": 3
    },
    {
      "id": "c6",
      "kind": "commit",
      "label": "C6",
      "col": 3,
      "row": 2
    },
    {
      "id": "m",
      "kind": "commit",
      "label": "M",
      "col": 4,
      "row": 2
    },
    {
      "id": "master",
      "kind": "ref",
      "label": "master",
      "col": 4,
      "row": 1
    },
    {
      "id": "head",
      "kind": "symref",
      "label": "HEAD",
      "col": 4,
      "row": 0,
      "dx": 0.5
    },
    {
      "id": "topic",
      "kind": "ref",
      "label": "topic",
      "col": 3,
      "row": 4
    }
  ],
  "edges": [
    { "from": "c2", "to": "c1" },
    { "from": "c5", "to": "c2" },
    { "from": "c3", "to": "c2", "route": "diagonal" },
    { "from": "c4", "to": "c3" },
    { "from": "c6", "to": "c5" },
    { "from": "m", "to": "c6" },
    { "from": "m", "to": "c4", "route": "diagonal" },
    { "from": "master", "to": "m", "arrow": "forward" },
    { "from": "head", "to": "master", "arrow": "forward" },
    { "from": "topic", "to": "c4", "arrow": "forward" }
  ]
}
