{
  "$schema": "./_schema.json",
  "title": "topic branches 1",
  "grid": {
    "x": 136.0,
    "y": 40.1
  },
  "nodes": [
    {
      "id": "c0",
      "kind": "commit",
      "label": "C0",
      "col": 1,
      "row": 9
    },
    {
      "id": "c1",
      "kind": "commit",
      "label": "C1",
      "col": 1,
      "row": 8,
      "dy": -12.79
    },
    {
      "id": "c3",
      "kind": "commit",
      "label": "C3",
      "col": 1,
      "row": 6,
      "dy": 14.41
    },
    {
      "id": "c9",
      "kind": "commit",
      "label": "C9",
      "col": 1,
      "row": 5,
      "dy": 1.51
    },
    {
      "id": "c10",
      "kind": "commit",
      "label": "C10",
      "col": 1,
      "row": 4,
      "dy": -11.39
    },
    {
      "id": "c2",
      "kind": "commit",
      "label": "C2",
      "col": 2,
      "row": 6,
      "dy": 14.41
    },
    {
      "id": "c4",
      "kind": "commit",
      "label": "C4",
      "col": 2,
      "row": 5,
      "dy": 1.51
    },
    {
      "id": "c5",
      "kind": "commit",
      "label": "C5",
      "col": 2,
      "row": 4,
      "dy": -11.39
    },
    {
      "id": "c6",
      "kind": "commit",
      "label": "C6",
      "col": 2,
      "row": 2,
      "dy": 15.81
    },
    {
      "id": "c12",
      "kind": "commit",
      "label": "C12",
      "col": 0,
      "row": 2,
      "dy": 15.81
    },
    {
      "id": "c13",
      "kind": "commit",
      "label": "C13",
      "col": 0,
      "row": 1,
      "dy": 2.91
    },
    {
      "id": "c7",
      "kind": "commit",
      "label": "C7",
      "col": 3,
      "row": 4,
      "dy": -11.39
    },
    {
      "id": "c8",
      "kind": "commit",
      "label": "C8",
      "col": 3,
      "row": 2,
      "dy": 15.81
    },
    {
      "id": "c11",
      "kind": "commit",
      "label": "C11",
      "col": 3,
      "row": 1,
      "dy": 2.91
    },
    {
      "id": "master",
      "kind": "ref",
      "label": "master",
      "col": 1,
      "row": 3,
      "dy": -14.39
    },
    {
      "id": "iss91",
      "kind": "ref",
      "label": "iss91",
      "col": 2,
      "row": 1,
      "dy": 12.91
    },
    {
      "id": "iss91v2",
      "kind": "ref",
      "label": "iss91v2",
      "col": 3,
      "row": 0
    },
    {
      "id": "dumbidea",
      "kind": "ref",
      "label": "dumbidea",
      "col": 0,
      "row": 0
    }
  ],
  "edges": []
}
