{
  "$schema": "./_schema.json",
  "title": "rebasing 2",
  "grid": {
    "x": 118.8,
    "y": 55.0
  },
  "nodes": [
    {
      "id": "node_0b743",
      "kind": "commit",
      "label": "0b743",
      "col": 0,
      "row": 1,
      "dy": 2.0
    },
    {
      "id": "a6b4c",
      "kind": "commit",
      "label": "a6b4c",
      "col": 1,
      "row": 1,
      "dy": 2.0
    },
    {
      "id": "f42c5",
      "kind": "commit",
      "label": "f42c5",
      "col": 2,
      "row": 1,
      "dy": 2.0
    },
    {
      "id": "a0a41",
      "kind": "commit",
      "label": "a0a41",
      "col": 3,
      "row": 1,
      "dy": 2.0
    },
    {
      "id": "master",
      "kind": "ref",
      "label": "master",
      "col": 3,
      "row": 0
    },
    {
      "id": "e43a6",
      "kind": "commit",
      "label": "e43a6",
      "col": 2,
      "row": 2,
      "dy": -2.0
    },
    {
      "id": "node_5ddae",
      "kind": "commit",
      "label": "5ddae",
      "col": 3,
      "row": 2,
      "dx": 0.6,
      "dy": -2.0
    },
    {
      "id": "ruby-client",
      "kind": "ref",
      "label": "ruby_client",
      "col": 3,
      "row": 3,
      "dx": 0.6
    }
  ],
  "edges": [
    { "from": "a6b4c", "to": "node_0b743" },
    { "from": "f42c5", "to": "a6b4c" },
    { "from": "a0a41", "to": "f42c5" },
    { "from": "e43a6", "to": "a6b4c", "route": "diagonal" },
    { "from": "node_5ddae", "to": "e43a6" },
    { "from": "master", "to": "a0a41", "arrow": "forward" },
    { "from": "ruby-client", "to": "node_5ddae", "arrow": "forward" }
  ]
}
