{
  "$schema": "./_schema.json",
  "title": "perils of rebasing 3",
  "grid": {
    "x": 96.5,
    "y": 66.0
  },
  "nodes": [
    {
      "id": "c1",
      "kind": "commit",
      "label": "C1",
      "col": 0,
      "row": 1,
      "dy": -16.01
    },
    {
      "id": "master",
      "kind": "ref",
      "label": "master",
      "col": 4,
      "row": 0,
      "dx": -21.5
    },
    {
      "id": "c4",
      "kind": "commit",
      "label": "C4'",
      "col": 2,
      "row": 0,
      "dx": 43.0
    },
    {
      "id": "c5",
      "kind": "commit",
      "label": "C5",
      "col": 1,
      "row": 0,
      "dx": 21.51
    },
    {
      "id": "c4-2",
      "kind": "commit",
      "label": "C4",
      "col": 1,
      "row": 1,
      "dx": 21.51,
      "dy": -16.01
    },
    {
      "id": "c6",
      "kind": "commit",
      "label": "C6",
      "col": 2,
      "row": 1,
      "dx": 43.01,
      "dy": -16.01
    },
    {
      "id": "c1-2",
      "kind": "commit",
      "label": "C1",
      "col": 0,
      "row": 3,
      "dy": 15.89
    },
    {
      "id": "c2",
      "kind": "commit",
      "label": "C2",
      "col": 1,
      "row": 4,
      "dx": 21.51
    },
    {
      "id": "c3",
      "kind": "commit",
      "label": "C3",
      "col": 2,
      "row": 4,
      "dx": 43.0
    },
    {
      "id": "c7",
      "kind": "commit",
      "label": "C7",
      "col": 4,
      "row": 4,
      "dx": -32.04
    },
    {
      "id": "c4-3",
      "kind": "commit",
      "label": "C4'",
      "col": 2,
      "row": 2,
      "dx": 43.0,
      "dy": 31.89
    },
    {
      "id": "c4-4",
      "kind": "commit",
      "label": "C4",
      "col": 1,
      "row": 3,
      "dx": 21.5,
      "dy": 15.89
    },
    {
      "id": "c5-2",
      "kind": "commit",
      "label": "C5",
      "col": 1,
      "row": 2,
      "dx": 21.5,
      "dy": 31.89
    },
    {
      "id": "c6-2",
      "kind": "commit",
      "label": "C6",
      "col": 2,
      "row": 3,
      "dx": 43.0,
      "dy": 15.89
    },
    {
      "id": "master-2",
      "kind": "ref",
      "label": "master",
      "col": 5,
      "row": 4
    },
    {
      "id": "teamone-master",
      "kind": "ref",
      "label": "teamone/master",
      "col": 4,
      "row": 2,
      "dx": -21.54,
      "dy": 31.9
    }
  ],
  "edges": []
}
