{
  "$schema": "./_schema.json",
  "title": "basic rebase 2",
  "grid": {
    "x": 127.5,
    "y": 60.2
  },
  "nodes": [
    {
      "id": "c0",
      "kind": "commit",
      "label": "C0",
      "col": 0,
      "row": 2,
      "dy": -1.9
    },
    {
      "id": "c1",
      "kind": "commit",
      "label": "C1",
      "col": 1,
      "row": 2,
      "dx": -0.5,
      "dy": -1.9
    },
    {
      "id": "c2",
      "kind": "commit",
      "label": "C2",
      "col": 2,
      "row": 2,
      "dx": -1.0,
      "dy": -1.9
    },
    {
      "id": "experiment",
      "kind": "ref",
      "label": "experiment",
      "col": 3,
      "row": 0,
      "dx": -0.5
    },
    {
      "id": "c4",
      "kind": "commit",
      "label": "C4",
      "col": 3,
      "row": 1,
      "dx": -0.5
    },
    {
      "id": "c3",
      "kind": "commit",
      "label": "C3",
      "col": 3,
      "row": 2,
      "dx": -0.5,
      "dy": -1.9
    },
    {
      "id": "c5",
      "kind": "commit",
      "label": "C5",
      "col": 4,
      "row": 2,
      "dy": -1.9
    },
    {
      "id": "master",
      "kind": "ref",
      "label": "master",
      "col": 4,
      "row": 3
    }
  ],
  "edges": [
    { "from": "c1", "to": "c0" },
    { "from": "c2", "to": "c1" },
    { "from": "c3", "to": "c2" },
    { "from": "c4", "to": "c2", "route": "diagonal" },
    { "from": "c5", "to": "c4", "route": "diagonal" },
    { "from": "experiment", "to": "c5", "arrow": "forward" },
    { "from": "master", "to": "c4", "arrow": "forward" }
  ]
}
