{
  "$schema": "./_schema.json",
  "title": "rerere1",
  "grid": {
    "x": 152.9,
    "y": 66.0
  },
  "nodes": [
    {
      "id": "master",
      "kind": "ref",
      "label": "master",
      "col": 1,
      "row": 0
    },
    {
      "id": "hello-world",
      "kind": "commit",
      "label": "hello world",
      "col": 0,
      "row": 1,
      "dy": 1.9
    },
    {
      "id": "world",
      "kind": "commit",
      "label": "world",
      "col": 1,
      "row": 1,
      "dy": 1.9
    },
    {
      "id": "hello",
      "kind": "commit",
      "label": "hello",
      "col": 1,
      "row": 2,
      "dy": -2.1
    },
    {
      "id": "i18n-world",
      "kind": "ref",
      "label": "i18n-world",
      "col": 1,
      "row": 3
    }
  ],
  "edges": []
}
