{
  "$schema": "./_schema.json",
  "title": "rebasing 1",
  "grid": {
    "x": 119.0,
    "y": 55.0
  },
  "nodes": [
    {
      "id": "node_0b743",
      "kind": "commit",
      "label": "0b743",
      "col": 0,
      "row": 1,
      "dy": 2.0
    },
    {
      "id": "a6b4c",
      "kind": "commit",
      "label": "a6b4c",
      "col": 1,
      "row": 1,
      "dy": 2.0
    },
    {
      "id": "f42c5",
      "kind": "commit",
      "label": "f42c5",
      "col": 2,
      "row": 1,
      "dy": 2.0
    },
    {
      "id": "e43a6",
      "kind": "commit",
      "label": "e43a6",
      "col": 2,
      "row": 2,
      "dy": -2.0
    },
    {
      "id": "node_5ddae",
      "kind": "commit",
      "label": "5ddae",
      "col": 3,
      "row": 2,
      "dy": -2.0
    },
    {
      "id": "master",
      "kind": "ref",
      "label": "master",
      "col": 2,
      "row": 0
    },
    {
      "id": "ruby-client",
      "kind": "ref",
      "label": "ruby_client",
      "col": 3,
      "row": 3
    }
  ],
  "edges": []
}
