{
  "$schema": "./_schema.json",
  "title": "remote branches 4",
  "grid": {
    "x": 85.7,
    "y": 73.1
  },
  "nodes": [
    {
      "id": "node_0b743",
      "kind": "commit",
      "label": "0b743",
      "col": 0,
      "row": 3,
      "dx": 2.5,
      "dy": 36.02
    },
    {
      "id": "a6b4c",
      "kind": "commit",
      "label": "a6b4c",
      "col": 1,
      "row": 3,
      "dx": 33.79,
      "dy": 36.02
    },
    {
      "id": "f4265",
      "kind": "commit",
      "label": "f4265",
      "col": 3,
      "row": 3,
      "dx": -20.61,
      "dy": 36.02
    },
    {
      "id": "node_31b8e",
      "kind": "commit",
      "label": "31b8e",
      "col": 4,
      "row": 3,
      "dx": 11.69,
      "dy": 36.02
    },
    {
      "id": "node_190a3",
      "kind": "commit",
      "label": "190a3",
      "col": 6,
      "row": 3,
      "dx": -42.71,
      "dy": 36.02
    },
    {
      "id": "a38de",
      "kind": "commit",
      "label": "a38de",
      "col": 4,
      "row": 4,
      "dx": 11.69,
      "dy": 19.92
    },
    {
      "id": "node_893cf",
      "kind": "commit",
      "label": "893cf",
      "col": 6,
      "row": 4,
      "dx": -42.71,
      "dy": 19.92
    },
    {
      "id": "master",
      "kind": "ref",
      "label": "master",
      "col": 6,
      "row": 5,
      "dx": -42.7
    },
    {
      "id": "origin-master",
      "kind": "ref",
      "label": "origin/master",
      "col": 6,
      "row": 3,
      "dx": -42.7,
      "dy": -16.98
    },
    {
      "id": "f4265-2",
      "kind": "commit",
      "label": "f4265",
      "col": 0,
      "row": 1,
      "dx": -2.5,
      "dy": -19.78
    },
    {
      "id": "node_31b8e-2",
      "kind": "commit",
      "label": "31b8e",
      "col": 1,
      "row": 1,
      "dx": 26.79,
      "dy": -19.78
    },
    {
      "id": "node_190a3-2",
      "kind": "commit",
      "label": "190a3",
      "col": 3,
      "row": 1,
      "dx": -28.61,
      "dy": -19.78
    },
    {
      "id": "master-2",
      "kind": "ref",
      "label": "master",
      "col": 3,
      "row": 0,
      "dx": -28.6
    },
    {
      "id": "f4265-3",
      "kind": "commit",
      "label": "f4265",
      "col": 5,
      "row": 1,
      "dx": -29.0,
      "dy": -19.78
    },
    {
      "id": "node_31b8e-3",
      "kind": "commit",
      "label": "31b8e",
      "col": 6,
      "row": 1,
      "dy": -19.78
    },
    {
      "id": "master-3",
      "kind": "ref",
      "label": "master",
      "col": 6,
      "row": 0
    }
  ],
  "edges": [
    { "from": "a6b4c", "to": "node_0b743" },
    { "from": "f4265", "to": "a6b4c" },
    { "from": "node_31b8e", "to": "f4265" },
    { "from": "node_190a3", "to": "node_31b8e" },
    { "from": "origin-master", "to": "node_190a3", "arrow": "forward" },
    { "from": "a38de", "to": "node_190a3" },
    { "from": "node_893cf", "to": "a38de" },
    { "from": "master", "to": "node_893cf", "arrow": "forward" },
    { "from": "f4265-2", "to": "a6b4c" },
    { "from": "node_31b8e-2", "to": "f4265-2" },
    { "from": "node_190a3-2", "to": "node_31b8e-2" },
    { "from": "master-2", "to": "node_190a3-2", "arrow": "forward" },
    { "from": "f4265-3", "to": "node_31b8e-2" },
    { "from": "node_31b8e-3", "to": "f4265-3" },
    { "from": "master-3", "to": "node_31b8e-3", "arrow": "forward" }
  ]
}
